{
  "schema": "math-commons-job-catalog/v2",
  "updated": "2026-08-21",
  "repository": "https://github.com/KokunoYumeto/mathematics-commons-pilot",
  "release": {
    "tag": "jobs-2026-08-21-r2",
    "url": "https://github.com/KokunoYumeto/mathematics-commons-pilot/releases/tag/jobs-2026-08-21-r2",
    "asset_limit": "Each asset is below GitHub's 2 GiB per-file limit; multipart assets preserve one job when needed."
  },
  "interaction": {
    "prompt_count_rule": "Use each job's declared prompt_count; counts are workload-derived with no global minimum or maximum.",
    "in_progress_reply": "continue",
    "complete_reply": "next prompt",
    "terminal_rule": "The final declared prompt completes only after PASS and requests no successor.",
    "state_rule": "Every response returns the newest cumulative full-state ZIP, checkpoint, and manifest.",
    "duration_rule": "No assumed time, runtime, token, response-count, or effort limit applies.",
    "defect_rule": "Resolve defects from attached authority evidence, record the repair, and rerun a fresh nonpatching audit until PASS; ordinary HOLD or terminal FAIL is not an outcome."
  },
  "admission": {
    "rule": "Only exact root-replayed packets with complete attached authority, cumulative state continuity, recorded in-workflow repair, and a fresh PASS admission row are runnable.",
    "packet_count": 28,
    "source_files": 538,
    "source_bytes": 8922333939,
    "audit_receipt": {
      "basename": "r2-admission.json",
      "bytes": 88449,
      "sha256": "C6D7B5F02DEBF227A61DBD1B611AD79F7AC1F3F0AC3A1634EC18DA8B759F40EC",
      "receipt_scope": "Fresh frozen-28 local R2 admission replay; publication and remote readback are explicitly pending.",
      "included_in_packet": false,
      "public_projection": {
        "path": "catalog/receipts/r2-admission.json",
        "bytes": 88449,
        "sha256": "C6D7B5F02DEBF227A61DBD1B611AD79F7AC1F3F0AC3A1634EC18DA8B759F40EC",
        "transformations": [
          "Generated directly from frozen packet identifiers and exact byte replays; no private filesystem path is emitted."
        ]
      }
    },
    "hardening_receipt": {
      "basename": "no-failure-hardening.json",
      "bytes": 28430,
      "sha256": "1961AF0B9EA3A0719ACE87F55F6195E8F07AE8CA453880A8BBDA241A40647D66",
      "receipt_scope": "Fresh bounded no-failure/no-time-limit control replay for the same frozen 28 packet roots.",
      "included_in_packet": false,
      "public_projection": {
        "path": "catalog/receipts/no-failure-hardening.json",
        "bytes": 28430,
        "sha256": "1961AF0B9EA3A0719ACE87F55F6195E8F07AE8CA453880A8BBDA241A40647D66",
        "transformations": [
          "Generated directly from frozen packet identifiers and exact byte replays; no private filesystem path is emitted."
        ]
      }
    }
  },
  "translation_kit": {
    "asset_manifest": {
      "path": "catalog/assets/translation-kit.json",
      "bytes": 1464,
      "sha256": "706C80D8B90BF65717BED7A650ED4AC5D475657B6084CEC074F2972A6576172A"
    },
    "assets": [
      {
        "name": "open-textbook-translation-kit.zip",
        "part": 1,
        "parts": 1,
        "source_files": 4,
        "source_bytes": 5650,
        "first_path": "PROMPT.md",
        "last_path": "SOURCE.json",
        "zip_bytes": 3443,
        "zip_sha256": "22383513B060A7E08D7F693F833C6BC8DDBDF256C2816DC842C0D0F2E1BE929C",
        "url": "https://github.com/KokunoYumeto/mathematics-commons-pilot/releases/download/jobs-2026-08-21-r2/open-textbook-translation-kit.zip"
      }
    ]
  },
  "jobs": [
    {
      "id": "al-battani-nallino-opus-astronomicum-1899-1907",
      "packet_id": "AL_BATTANI_OPUS_ASTRONOMICUM_NALLINO_1899_1907_REPAIR",
      "authors": [
        "Al-Battani",
        "Carlo Alfonso Nallino (editor and translator)"
      ],
      "title": "Opus Astronomicum / al-Zij al-Sabi",
      "edition": "Nallino three-part exact edition, 1899-1907",
      "source_languages": [
        "Arabic",
        "Latin",
        "editorial languages as witnessed"
      ],
      "target_outputs": [
        "Arabic diplomatic root edition",
        "Latin historical translation edition",
        "separate Nallino editorial-language artifact or artifacts",
        "standalone English edition",
        "restrained critical apparatus"
      ],
      "scope": "Exactly the complete Nallino three-part edition; no other Al-Battani work.",
      "physical_pages": 1162,
      "page_note": "Every physical PDF page 1-1162 receives a disposition; Part III contains the Arabic root in reverse scan order.",
      "pack_scope": "direct_files",
      "source_files": 17,
      "source_bytes": 118219716,
      "authority": [
        {
          "path": "20_AL_BATTANI_OPUS_ASTRONOMICUM_NALLINO_PARS_I_II_III_1162P_AUTHORITY.pdf",
          "pages": 1162,
          "note": "Complete controlling physical witness.",
          "sha256": "544C16B6355C9B74E281ADED657D657224BFF738366D5260E1A610D31B0D6297"
        }
      ],
      "status": "PASS_GLOBAL_COLD_AUDIT",
      "audit_basis": "global_receipt",
      "prompt_count": 45,
      "packet_manifest": {
        "basename": "98_PACKET_MANIFEST_SHA256.tsv",
        "bytes": 1788,
        "sha256": "F486847486D986B89099592806C3F1980075B5FE894AD5C4AB9F1F06B7DC3D4A"
      },
      "validation_receipt": {
        "basename": "r2-admission.json",
        "bytes": 88449,
        "sha256": "C6D7B5F02DEBF227A61DBD1B611AD79F7AC1F3F0AC3A1634EC18DA8B759F40EC",
        "receipt_scope": "Fresh frozen-28 local R2 admission replay; publication and remote readback are explicitly pending.",
        "included_in_packet": false,
        "public_projection": {
          "path": "catalog/receipts/r2-admission.json",
          "bytes": 88449,
          "sha256": "C6D7B5F02DEBF227A61DBD1B611AD79F7AC1F3F0AC3A1634EC18DA8B759F40EC",
          "transformations": [
            "Generated directly from frozen packet identifiers and exact byte replays; no private filesystem path is emitted."
          ]
        }
      },
      "proposed_asset_base_name": "al-battani-nallino-opus-astronomicum-1899-1907",
      "rights_note": "The complete master is attached, but the audited controls do not state the provider's scan-payload reuse license. No blanket scan license is claimed; preserve exact provenance and report any substantiated rights or attribution issue.",
      "effort": {
        "model_tier": "frontier_multimodal_high_reasoning",
        "scale": "extreme",
        "rough_elapsed": "6-12 weeks",
        "heuristic_note": "Conservative planning heuristic only, not measured runtime or a price quote; assumes the full 45-prompt workflow, continuation turns, deterministic builds, and at least one cold-audit cycle."
      },
      "start_file": {
        "basename": "00_READ_FIRST.md",
        "bytes": 3592,
        "sha256": "9753B6CD33FA69D48C3FF50DDE2027D1BC138C32F50636118F96D5E04FD990D1"
      },
      "prompt_file": {
        "basename": "04_ALL_45_LITERAL_SESSION_PROMPTS.md",
        "bytes": 266631,
        "sha256": "26F60303F710F269E977F2071DCDA29DF1D95368CC7FB281C00FAEFE2AC1FC8F"
      },
      "catalog_status": "runnable",
      "asset_manifest": {
        "path": "catalog/assets/al-battani-nallino-opus-astronomicum-1899-1907.json",
        "bytes": 4039,
        "sha256": "73549BC10EF893B85DDED51C7DA99B8A6008F1C9FD76DFDD6786FC646E307173"
      },
      "assets": [
        {
          "name": "al-battani-nallino-opus-astronomicum-1899-1907.zip",
          "part": 1,
          "parts": 1,
          "source_files": 17,
          "source_bytes": 118219716,
          "first_path": "00_READ_FIRST.md",
          "last_path": "99_VALIDATION_RECEIPT.json",
          "zip_bytes": 116634198,
          "zip_sha256": "6E1F0960D265CF8038ACDA3A9C4A1EF60042855694E1C472BC710F249714225A",
          "url": "https://github.com/KokunoYumeto/mathematics-commons-pilot/releases/download/jobs-2026-08-21-r2/al-battani-nallino-opus-astronomicum-1899-1907.zip"
        }
      ]
    },
    {
      "id": "al-khwarizmi-al-jabr-cairo-1939",
      "packet_id": "AL_KHWARIZMI_AL_JABR_1939_EDITION_REPAIR",
      "authors": [
        "Muhammad ibn Musa al-Khwarizmi",
        "Ali Mustafa Musharrafa (editor)",
        "Muhammad Mursi Ahmad (editor)"
      ],
      "title": "Kitab al-jabr wa-al-muqabalah",
      "edition": "Cairo Arabic edition, 1939",
      "source_languages": [
        "Arabic"
      ],
      "target_outputs": [
        "Arabic diplomatic edition",
        "standalone English edition",
        "restrained critical apparatus",
        "physical-frame and provenance ledger"
      ],
      "scope": "Exactly the 1939 Cairo edition represented by physical frames 001-130.",
      "physical_pages": 130,
      "page_note": "Physical frames, not inferred printed pagination, are the controlling topology.",
      "pack_scope": "direct_files",
      "source_files": 28,
      "source_bytes": 406586698,
      "authority": [
        {
          "path": "20_AL_KHWARIZMI_AL_JABR_1939_AUTHORITY_FRAMES_001-035_400PPI.zip",
          "pages": 35,
          "note": "Controlling pixels, frames 001-035.",
          "sha256": "9297AA946D4E676066A78A6A5CAE684B1E95B4EC4EE44FF60BF00EF31D62BC4D"
        },
        {
          "path": "21_AL_KHWARIZMI_AL_JABR_1939_AUTHORITY_FRAMES_036-070_400PPI.zip",
          "pages": 35,
          "note": "Controlling pixels, frames 036-070.",
          "sha256": "CE3529CB28D79049D467D6AB454FB38FE6E21FAA32512B99A47489D535E65955"
        },
        {
          "path": "22_AL_KHWARIZMI_AL_JABR_1939_AUTHORITY_FRAMES_071-105_400PPI.zip",
          "pages": 35,
          "note": "Controlling pixels, frames 071-105.",
          "sha256": "CCDC460235D6EB7B02402A83E968ADF8FBF40DE4025E36F3654296F004D85434"
        },
        {
          "path": "23_AL_KHWARIZMI_AL_JABR_1939_AUTHORITY_FRAMES_106-130_400PPI.zip",
          "pages": 25,
          "note": "Controlling pixels, frames 106-130.",